{
  "id": "dignio-2026-024",
  "title": "Dignio - Connected Care and Remote Monitoring Platform",
  "company": "Dignio",
  "country": "Norway",
  "region": "Nordics",
  "segment": "monitoring",
  "problem": "Healthcare systems struggle to monitor chronic patients effectively. Patients with multiple conditions fall between the cracks, leading to preventable hospitalizations.",
  "solution": "Connected care platform enabling remote patient monitoring, care coordination across providers, and proactive intervention for chronic disease management.",
  "technology": "IoT devices, cloud platform, care coordination tools, EHR integration",
  "target_customer": "Health systems, municipalities, home care providers",
  "care_setting": "home",
  "care_domain": "chronic disease, elderly care",
  "care_stage": "monitoring",
  "automation_level": "partial",
  "ai_type": null,
  "traction_signals": [
    "Founded 2009, Norway-based",
    "Deployed across Norwegian municipalities",
    "Expanded to UK and other European markets",
    "Focus on elderly care and chronic conditions"
  ],
  "funding": null,
  "regulatory_notes": "Medical device platform, data security compliance.",
  "varden_fit": "Moderate — RPM and care coordination could complement Varden's clinic marketplace. Different customer segment (municipalities vs private clinics).",
  "source": "Nordic health tech knowledge",
  "url": "https://www.dignio.com",
  "date_added": "2026-03-11",
  "notes": "Norwegian RPM player. Strong in municipality home care segment."
}
